id;key;French;Dutch;English;Portuguese;Swedish;Norwegian;Danish
354583a9f072faee6fad2e8e17038b89;language.selectlanguage;Sélectionnez votre langue;Selecteer je taal;Select your language;Selecione o seu idioma;Välj språk;Velg språk;Vælg sprog
bed6c2697ef1ab947f88ea8a1eaa5e63;landing.tours.title;Notre catalogue de circuits;Onze catalogus met rondleidingen;Our Catalogue of Tours;Nosso catálogo de tours;Vår katalog med utflykter;Vår rundreisekatalog;Vores katalog med rundture
be7cdd37745cf81b28ef9e51a5d598e5;tours.category.individual.navigationlabel;Circuits individuels;Individuele rondreizen;Individual Tours;Tours individuais;Individuella utflykter;Individuelle rundreiser;Individuelle rundture
eb94e03f54f3a14af31682f2fb5aad83;tours.category.individual.title;Circuits individuels;Individuele rondreizen;Individual Tours;Tours individuais;Individuella utflykter;Individuelle rundreiser;Individuelle rundture
d461f2eb83e6c745b10881fa3eb584f1;tours.category.individual.subtitle;Avec un guide touristique personnel;Met een persoonlijke gids;With a personal tour guide;Com guia turístico pessoal;Med en personlig reseledare;Med en personlig guide;Med en personlig turguide
96171132e76eece8fb8365f7826ebbe5;tours.category.individual.tag;Des expériences inoubliables;Onvergetelijke ervaringen;Unforgettable Experiences;Experiências inesquecíveis;Oförglömliga upplevelser;Uforglemmelige opplevelser;Uforglemmelige oplevelser
daeb579a2eb7f5dc96cf75a3f8e7db6d;tours.category.group.navigationlabel;Circuits de groupe;Groepsrondreizen;Group Tours;Tours em grupo;Gruppresor;Gruppereiser;Grupperundture
880e6d1c7f9d6b30001a766c02b79fc4;tours.category.group.title;Circuits de groupe;Groepsrondreizen;Group Tours;Tours em grupo;Gruppresor;Gruppereiser;Grupperundture
45d841aa1334435c003b0058133d8d12;tours.category.group.subtitle;Rejoignez nos guides locaux experts et nos aventuriers;Ga mee met onze deskundige lokale gidsen en avonturiers;Join our expert local guides and adventurers;Junte-se aos nossos aventureiros e guias locais treinados;Följ med våra kunniga lokalguider och äventyrare;Bli med våre dyktige lokale guider og eventyrere;Deltag sammen med vores dygtige lokale guider og eventyrere
bc9b907f7c1d74e39941a9ee01533f31;tours.category.group.tag;Nos meilleures ventes;Onze bestseller;Our Best Seller;Nossos best-sellers;Våra bästsäljare;Våre bestselgere;Vores mest populære
2890e9fc01c2199d66041b0840a6e56b;tours.category.selfdrive.navigationlabel;Circuits Fly & Drive;Selfdrive rondreizen;Selfdrive Tours;Tours autoguiados;Kör-själv-tur;Kjør-selv-turer;Kør-selv ture
782756154a3db9c8b194654057384713;tours.category.selfdrive.title;Circuits Fly & Drive;Selfdrive rondreizen;Selfdrive Tours;Tours autoguiados;Kör-själv-tur;Kjør-selv-turer;Kør-selv ture
65bbc4434315a4c262fa3c6c4f7bf294;tours.category.selfdrive.subtitle;Volez, conduisez et vivez le rêve;Vlieg, rijd en leef je droom;Fly, drive and live the dream;Voe, passeie e viva o seu sonho;Flyg, kör och förverkliga din dröm;Fly, kjør og gjør drømmen din virkelig;Flyv, kør og lev drømmen ud
68fea4a43263cd391c6d14e2700e15aa;tours.category.selfdrive.tag;Parfait pour les aventuriers intrépides;Perfect voor onverschrokken avonturiers;Perfect for intrepid adventurers;Perfeito para aventureiros destemidos;Perfekt för djärva äventyrare;Perfekt for uredde eventyrere;Ideel for dristige eventyrere
9435b5ae2c5b1a1c5921996cb1b23a4b;homepage.hero.title;Il est temps de voir le monde;Het is tijd om de wereld te zien;It's time to see the world;É hora de ver o mundo;Det är dags att se världen;Det er på tide å se verden;Det er tid til at opleve verden
7b0b0406f4e9393d5e80624a01178488;homepage.hero.paragraph;Ces moments inoubliables qui enrichissent votre vie.;Onvergetelijke momenten die je leven verrijken;Unforgettable moments that make life richer;Momentos inesquecíveis que enriquecem a vida;Oförglömliga ögonblick som förgyller ditt liv;Uforglemmelige øyeblikk som gjør livet rikere;Mindeværdige øjeblikke, der gør livet mere mangfoldigt
0ba3e4c70036fcff9e20b6fca8af10e6;homepage.hero.label;Circuits TUI;TUI tours;Tui tours;TUI tours;Tui Tours;TUI Tours;Tui Tours
3fe782725b3a9a0598e5735355ded800;messages.error.invalidMarketCode.title;Code de marché incorrect;Onjuiste marktcode;Incorrect market code;Código de mercado incorreto;Felaktig marknadskod;Feil markedskode;Ukorrekt markedskode
595eb2910337516f343ca69597d61946;messages.error.invalidMarketCode.message;Veuillez choisir un code de marché valide.;Sorry, je moet een geldige marktcode kiezen;Sorry, You have to choose a valid market code;Lamentamos, mas você deve escolher um código de mercado válido;Du måste välja en giltig marknadskod;Beklager, du må velge en gyldig markedskode;Beklager, du bliver nødt til at vælge en gyldig markedskode.
0b5339dec7ad8c58747c50fd99005cca;buttons.text.tryAgain;Essayez à nouveau;Probeer het nog eens;Try again;Tente novamente;Försök igen;Prøv igjen;Prøv igen
948a9429bc7bdd58686de9deebe5c845;buttons.text.seeAllAvailableTours;Voir tous les circuits disponibles...;Zie alle beschikbare rondreizen...;See all available tours...;Ver todos os tours disponíveis...;Se alla tillgängliga utflykter...;Se alle tilgjengelige rundreiser;Se alle tilgængelige rundture
11386c03d79faee12f6ae7e537ca84de;messages.error.loadingError.title;Oops, il semble y avoir une erreur;Oeps, er is een fout opgetreden;Oops, there was an error;Opa, ocorreu um erro;Oj, ett fel har uppstått;Ups, det oppstod en feil;Ups, der er opstået en fejl
c0413203df6f1a2fd330dd65fe314c59;messages.error.loadingError.message;C'est pourquoi nous ne pouvons pas vous montrer les résultats;En daarom kunnen we u geen resultaten laten zien;And that's why we can't show you results;E é por isso que não conseguimos mostrar resultados;Det är därför vi inte kan visa dig några resultat;Og det er derfor vi ikke kan vise deg noen resultater;Og det er derfor, vi ikke kan vise dig nogen resultater
557816878687d1e32f231aaea1781deb;messages.error.emptyResultsError.title;Il n'y a pas de circuits disponibles pour le moment;Er zijn op dit moment geen beschikbare rondreizen;Det er ingen tilgjengelige utflukter for øyeblikket;Não há tours disponíveis no momento;Det finns inga tillgängliga utflykter för tillfället;Det finnes ingen tilgjengelige rundreiser i øyeblikket;Der er ingen tilgængelige rundture i øjeblikket
2b49776cbe5fe2f86ec039e4941efc32;messages.error.emptyResultsError.message;Mais ne vous inquiétez pas, vous pouvez explorer d'autres catégories ou effectuer une recherche;Maar maak je geen zorgen, je kunt andere categorieën verkennen of een zoekopdracht uitvoeren;But don't worry, you can explore other categories or perform a search;Não se preocupe. Você pode explorar outras categorias ou realizar uma pesquisa;Men oroa dig inte, du kan utforska andra kategorier eller göra en ny sökning;Ikke bekymre deg, du kan utforske andre kategorier eller gjøre et nytt søk;Men bare rolig, du kan udforske andre kategorier eller lave en anden søgning
eb96341cfbdb2c8ae3c957900f75d712;buttons.text.contactUs;Contactez-nous;Neem contact met ons op;Contact Us;Fale conosco;Kontakta oss;Kontakt oss;Kontakt os
d9a018cfe369f6e8b59ec72c7ccccde0;buttons.text.informationAndConditions;Informations importantes et conditions;Belangrijke informatie en voorwaarden;Important information and conditions;Informações importantes e condições;Viktig information och villkor;Viktig informasjon og vilkår;Vigtig information og vilkår
cbece995cdf877cd7c9eaf27bd8f1ed9;buttons.text.aboutWebsiteUsage;Informations sur l'utilisation du site web;Informatie over het websitegebruik;Information about website usage;Informações sobre o uso do site;Information om användning av hemsidan;Informasjon om bruk av nettsiden;Oplysninger om brug af hjemmesiden
2dfd438087a02e554d9b85de5cbd2e99;footer.headings.exploreOurTours;Explorez nos circuits;Ontdek onze rondreizen;Explore our Tours;Explore os nossos tours;Utforska våra utflykter;Utforsk rundreisene våre;Udforsk vores rundture
2ae9838dad026a3b0c5daff4db524bac;footer.headings.needHelp;Besoin d'aide ?;Hulp nodig?;Need Help?;Precisa de ajuda?;Behöver du hjälp?;Trenger du hjelp? ;Brug for hjælp?
4be704c385f355d233d335ce8d58b49c;footer.headings.moreInfoAboutUs;Plus d'informations nous concernant;Meer info over;More info about us;Mais informações sobre nós;Mer information om oss;Mer informasjon om oss;Yderligere information om os
563ace534a2f3a94cb3298f710d04fe5;messages.loading;Téléchargement;Bezig met laden;Loading;Carregando;Laddar;Laster;Indlæser
b16ace706860a00aeec02dd756257025;landing.individual.hero.label;Un voyage flexible et unique.;Flexibel en uniek;Flexible & unique;Flexíveis e únicos;Flexibel och unik;Fleksibel & unik;Fleksibel & unik
1499c5b050b9df91f608196ca053c57d;landing.individual.hero.title;Circuits individuels;Individuele rondreizen;Individual Tours;Tours individuais;Individuella utflykter;Individuelle rundreiser;Individuelle rundture
1c89f09efbeeba6bf28d5e0ae502c562;landing.individual.hero.paragraph;Découvrez le monde à votre façon.;Ontdek de wereld zoals jij het wilt.;Discover the world your way;Conheça o mundo do seu jeito;Upptäck världen på ditt sätt;Opplev verden på din måte;Opdag verden på din måde
992fb9f749344a481e6081c88807a82f;landing.individual.staticContent.title;Une nouvelle aventure chaque jour, à votre façon.;Elke dag een nieuw avontuur;A new adventure every day – your way.;Uma nova aventura todos os dias, do seu jeito.;Ett nytt äventyr varje dag - på ditt sätt.;Et nytt eventyr hver dag – på din måte;Et nyt eventyr hver dag - på din måde.
b76c0583aba5a18b50561b68a2129ccb;landing.individual.staticContent.subtitle;Explorez votre destination à votre rythme, au volant d'une voiture ou avec un guide privé.;Ontdek een land écht, op jouw tempo - per huurwagen, of met een privéchauffeur/gids;Explore at your own pace - on a self-drive or with a private guide;Explore no seu próprio ritmo, de forma autoguiada ou com um guia privado;Utforska i din egen takt - på egen hand eller med en privat guide;Utforsk i ditt eget tempo – kjør selv eller med en privat guide;Udforsk i dit eget tempo - kør selv eller med en privat guide
9809b213988931e496fa4b26f9d671a8;landing.individual.staticContent.paragraph;Certains circuits vous proposent de suivre un itinéraire prédéfini, en vous octroyant des arrêts photo ou des petits détours quand vous en avez envie. D'autres circuits constituent plutôt une source d'inspiration et vous offrent la possibilité d'apporter les changements que vous souhaitez.;Wij hebben voor jou de mooiste routes uitgestippeld. Sommige van onze rondreizen volgen een vooraf bepaalde route, andere rondreizen dienen als inspiratie en geven je de flexibiliteit om zelf wijzigingen door te voeren.;On some tours, you drive along a predefined route, take photo stops or little detours whenever you crave it. Other tours serve as inspiration and offer the flexibility to make the changes you want.;Em alguns tours, você passeia por uma rota predefinida e faz paradas para tirar fotos ou pequenos desvios sempre que tiver vontade. Outros tours servem como inspiração e dispõem da flexibilidade de fazer as alterações que você desejar.;På vissa utflykter kör du längs en fördefinierad rutt, gör fotostopp eller små omvägar när du känner för det. Andra utflykter fungerar som inspiration och erbjuder flexibiliteten att göra de ändringar du vill.;På noen turer kjører du langs en forhåndsbestemt rute, gjør fotostopp eller tar små avstikkere når du har lyst. Andre turer fungerer som inspirasjon og gir deg fleksibilitet til å gjøre de endringene du ønsker.;På nogle rundture kører du ad en foruddefineret rute, gør fotostop eller tager små afstikkere, når du har lyst til det. Andre rundture fungerer som inspiration og giver fleksibilitet til at lave de ændringer, som du ønsker.
b1a95d2f8a3fa029eecffe42ce962c07;landing.individual.staticContent.cards.card1.title;Flexibilité;Flexibiliteit;Flexibility;Flexibilidade;Flexibilitet;Fleksibilitet;Fleksibilitet
4f304c488e93f9b37c82c7d269045123;landing.individual.staticContent.cards.card1.subtitle;Découvrez nos circuits d'inspiration;Ontdek onze inspirerende rondreizen per huurwagen;Explore our inspirational tours;Explore os nossos tours inspiradores;Utforska våra inspirerande utflykter;Utforsk de inspirerende rundreisene våre;Udforsk vores inspirerende rundture
53e845bbd37f5e7de057c6acbd717f31;landing.individual.staticContent.cards.card2.title;Avec un guide ou en toute indépendance;Met privéchauffeur/gids of per huurwagen;Accompanied or independently;Acompanhado ou de forma independente;Med sällskap eller på egen hand;Ledsaget eller på egen hånd;Ledsaget eller på egen hånd
1a6fc7f19ee9a147ec391ce17c270ff6;landing.individual.staticContent.cards.card2.subtitle;Chaque destination est différente.;Elke bestemming is anders;Each destination is different;Cada destino é diferente;Varje resmål är unikt;Hvert reisemål er unikt;Hvert rejsemål er forskelligt
6cb73bafc1eb0be164d637be9a525cf1;landing.individual.staticContent.cards.card3.title;Authenticité et singularité;Authentiek en uniek;Authentic & unique;Autêntico e único;Autentisk och unik;Autentisk & unik;Autentisk og unik
c4761aedbbd4eae5933792f8294cf914;landing.individual.staticContent.cards.card3.subtitle;Nos circuits se distinguent par des rencontres locales et des activités qui vous permettent de vous immerger dans la culture et la nature.;Onze rondreizen staan in het teken van cultuur en natuur. Met extra aandacht voor lokale gebruiken en tradities, laten we je zo de werkelijke kleuren van een land beleven.;Our tours are marked by local encounters and hands-on activities that let you immerse yourself in local culture and nature.;Os nossos tours são marcados por atividades práticas e encontros locais, que possibilitam uma imersão na natureza e na cultura do local.;Våra utflykter präglas av lokala möten och praktiska aktiviteter som gör att du kan fördjupa dig i den lokala kulturen och naturen.;Rundreisene våre er preget av lokale møter og praktiske aktiviteter som lar deg fordype deg i lokal kultur og natur.;Vores rundture er præget af lokale møder og engagerende aktiviteter, der lader dig fordybe dig i den lokale kultur og natur.
73285883ddd70d6f03d944bf7545987f;landing.individual.staticContent.cards.card4.title;Voyages responsables;Verantwoord reizen;Responsible Travel;Viagem responsável;Ansvarsfullt resande;Ansvarlig turisme;Ansvarlig rejse
1cb94ea95015063142cd1d9ad3532e10;landing.individual.staticContent.cards.card4.subtitle;Nos circuits sont basés sur les normes élevées en matière de durabilité de TUI et soutiennent la TUI Care Foundation.;Onze tours zijn gebaseerd op de hoge duurzaamheidsnormen van TUI en ondersteunen de TUI Care Foundation.;Our tours are based on TUI's high sustainability standards and support the TUI Care Foundation.;Os nossos tours são baseados nos altos padrões de sustentabilidade da TUI e apoiam a TUI Care Foundation.;Våra resor är baserade på TUIs höga hållbarhetsstandarder och stödjer TUI Care Foundation.;Rundreisene våre er basert på TUIs høye bærekraftstandarder og støtter TUI Care Foundation.;Vores rundture er baseret på TUI's ambitiøse bæredygtighedsstandarder, og de støtter TUI Care Foundation.
527b5f65567b827f441e4865bede26db;landing.group.hero.label;Sans souci et en toute authenticité;Onbezorgd op avontuur;Hassle-free & authentic;Sem complicações e autênticos;Bekvämt och autentiskt;Komfortabelt & autentisk;Bekvemme og autentiske
5ea1ccbafe447f08570dbe99307f45d6;landing.group.hero.title;Circuits de groupe;Groepsreizen;Group Tours;Tours em grupo;Utflykter i grupp;Gruppereiser;Grupperundture
18eb2d07d930ca4ba4c7d2fd1b6c0e02;landing.group.hero.paragraph;Explorez de nouveaux horizons ensemble;Verken samen de wereld;Explore new horizons together;Explore novos horizontes acompanhado;Utforska nya horisonter tillsammans;Utforsk nye horisonter sammen;Udforsk nye horisonter sammen
80f8f7cf77faff1bcbb7b875cd3acfb2;landing.group.staticContent.title;Une aventure tout confort;Rondreizen in alle comfort, langs de beste routes;Convenience meets adventure;Um encontro entre praticidade e aventura;Bekvämlighet möter äventyr;Komfort møter opplevelser;Komfort møder eventyr
5454aeb9b606574a3013b1c172a13403;landing.group.staticContent.subtitle;Voyagez avec un petit groupe de personnes qui vous ressemblent.;Reis in een kleine groep van gelijkgestemde reizigers;Travel in a small group of like-minded travellers;Viaje em um pequeno grupo de viajantes que têm interesses semelhantes;Res i en liten grupp med likasinnade resenärer;Reis i en liten gruppe med likesinnede;Rejs i en lille gruppe af ligesindede rejsende
60a47eaface19305d2eb9a5b062f2137;landing.group.staticContent.paragraph;Une façon pratique et intéressante d'explorer une destination. Un guide expérimenté vous emmène dans les meilleurs endroits et vous fait vivre des expériences uniques, en vous permettant de découvrir la culture et le cœur d'un lieu unique sur terre.;Een makkelijke en boeiende manier om een bestemming te verkennen. En dit met een deskundige gids die je naar de beste locaties brengt en zorgt voor unieke ervaringen, waarbij je de cultuur en het hart van een speciale plek op aarde leert kennen.;A convenient and engaging way to explore a destination. A knowledgeable guide takes you to the best places and facilitates unique experiences, getting to know the culture and heart of a special place on earth.;Uma maneira prática e envolvente de explorar um destino. Um guia experiente leva você aos melhores lugares e viabiliza experiências únicas, permitindo que você conheça a cultura e o coração de um lugar especial.;Ett bekvämt och engagerande sätt att utforska en destination. En kunnig guide tar dig till de bästa platserna och ger dig unika upplevelser där du får lära känna kulturen och hjärtat på en speciell plats på jorden.;En praktisk og engasjerende måte å utforske et reisemål på. En kunnskapsrik guide tar deg med til de beste stedene og legger til rette for unike opplevelser, slik at du blir kjent med kulturen, tradisjonene og historien på stedet du besøker.;En bekvem og engagerende måde at udforske et rejsemål på. En vidende guide tager dig med til de bedste steder og skaber unikke oplevelser, så du lærer om kulturen, traditionerne og historien bag det særlige sted, du besøger.  
6fc3a829de599c5f2fb5067b5ea55cf4;landing.group.staticContent.cards.card1.title;De nombreux départs seront garantis tôt dans la saison.;Omdat je natuurlijk graag op vakantie wilt vertrekken, zorgen wij ervoor dat we zo vroeg mogelijk in het seizoen vertrekken garanderen.;A lot of departures will be guaranteed early in the season;Muitas partidas estarão garantidas no início da temporada;Många avgångar kommer att garanteras tidigt på säsongen;Det er garantert mange avganger tidlig i sesongen;Der er garanteret mange afgange tidligt på sæsonen.
e96b18a7c2301fc18777e3d785e6174f;landing.group.staticContent.cards.card1.subtitle;Retrouvez le symbole des départs garantis dans notre catalogue.;"In ons aanbod vind je bij elk vertrek dat wordt gegarandeerd het ""Gegarandeerd Vertrek"" logo.";Check for the Guaranteed Departures symbol in our catalogue.;Confira o símbolo de Partidas Garantidas no nosso catálogo.;Håll utkik efter symbolen för garanterade avgångar i vår katalog.;Se etter symbolet Garanterte avreiser i katalogen vår;Se efter symbolet Guaranteed Departures i vores katalog.
990881695b0b9c27953284303ef9308a;landing.group.staticContent.cards.card2.title;Guides expérimentés;Deskundige reisleiding;Knowledgeable Guides;Guias experientes;Kunniga guider;Kunnskapsrike guider;Vidende guider
0080e6bea4bdcb0bc7c48a4b36a6eea6;landing.group.staticContent.cards.card2.subtitle;Laissez nos guides expérimentés vous emmener hors des sentiers battus pour découvrir la destination à travers les yeux d'un local.;Onze ervaren reisleiders nemen je mee, weg van de gebaande paden, en laten je de bestemming ontdekken door de ogen van de lokale bevolking.;Let our experienced guides take you away from the beaten path to see the destination through the eyes of a local.;Permita que nossos guias experientes levem você para longe dos percursos habituais, para ver o seu destino através dos olhos de um morador local.;Låt våra erfarna guider föra dig bortom turiststråken och se resmålet ur en lokalpersons perspektiv.;De kunnskapsrike guidene våre tar deg med utenfor allfarvei og lar deg se reisemålet med lokalbefolkningens øyne.;Vores erfarne guider fører dig væk fra den slagne vej, så du kan se rejsemålet gennem de lokales øjne.
193e4997c2b2ee24a9166b9928df99d0;landing.group.staticContent.cards.card3.title;Authenticité et singularité;Authentiek en uniek;Authentic & unique;Autêntico e único;Autentisk och unik;Autentisk & unik;Autentisk og unik
039cec2f13c90030445108aa6fd1f98e;landing.group.staticContent.cards.card3.subtitle;Nos circuits se distinguent par des rencontres locales et des activités qui vous permettent de vous immerger dans la culture et la nature.;Onze rondreizen staan in het teken van cultuur en natuur. Met extra aandacht voor lokale gebruiken en tradities, laten we je zo de werkelijke kleuren van een land beleven.;Our tours are marked by local encounters and hands-on activities that let you immerse yourself in local culture and nature.;Os nossos tours são marcados por atividades práticas e encontros locais, que possibilitam uma imersão na natureza e na cultura do local.;Våra utflykter präglas av lokala möten och praktiska aktiviteter som låter dig fördjupa dig i den lokala kulturen och naturen.;Utfluktene våre er preget av lokale møter og praktiske aktiviteter som lar deg fordype deg i lokal kultur og natur.;Vores rundture er kendetegnet ved lokale møder og engagerende aktiviteter, der lader dig fordybe i den lokale kultur og natur.
ebbdf8da5fffd1440c5e9c8b0346f030;landing.group.staticContent.cards.card4.title;Voyages responsables;Verantwoord reizen;Responsible Travel;Viagem responsável;Ansvarsfullt resande;Ansvarlig turisme;Ansvarlig rejse
1d44517b2623b22cedca3b8c4697c99f;landing.group.staticContent.cards.card4.subtitle;Nos circuits sont basés sur les normes élevées en matière de durabilité de TUI et soutiennent la TUI Care Foundation.;Onze rondreizen zijn gebaseerd op de hoge duurzaamheidsnormen van TUI en ondersteunen de TUI Care Foundation.;Our tours are based on TUI's high sustainability standards and support the TUI Care Foundation.;Os nossos tours são baseados nos altos padrões de sustentabilidade da TUI e apoiam a TUI Care Foundation.;Våra utflykter är baserade på TUIs höga hållbarhetsstandarder och stödjer TUI Care Foundation.;Rundreisene våre er basert på TUIs høye bærekraftstandarder og støtter TUI Care Foundation.;Vores rundture er baseret på TUI's ambitiøse bæredygtighedsstandarder, og de støtter TUI Care Foundation.
69483bb77b56bc085f0e5266d6598b38;landing.selfdrive.hero.label;Circuits Fly & Drive;Selfdrive tours;Selfdrive Tours;Tours autoguiados;Kör-själv-tur;Kjør-selv-turer;Kør-selv ture 
01cf3c43d4060169076ef2b2dca5ceb6;landing.selfdrive.hero.title;Prenez l'avion, conduisez et vivez le rêve;Vlieg, rij en leef je droom;Fly, drive and live the dream;Voe, passeie e viva o seu sonho;Flyg, kör och förverkliga din dröm;Fly, kjør og gjør drømmen din virkelig;Flyv, kør og lev drømmen ud
f9d51074920ffc63753a2449bd8a49d7;landing.selfdrive.hero.paragraph;Explorez une destination à votre propre rythme;Verken een bestemming in je eigen tempo;Explore a destination at your own pace;Explore um destino no seu próprio ritmo;Utforska ett resmål i din egen takt;Utforsk reisemålet i ditt eget tempo;Udforsk et rejsemål i dit eget tempo
066e31fb788e79d8f7590414923153b1;landing.selfdrive.staticContent.title;Nos circuits Fly & Drive vous offrent la plus grande flexibilité.;Onze self-drive tours bieden je de grootst mogelijke flexibiliteit;Our self-drive tours offer you the utmost flexibility.;Nossos tours autoguiados oferecem a máxima flexibilidade.;Våra utflykter där du kör själv ger dig största möjliga flexibilitet.;Rundreisene våre der du kjører selv gir deg stor fleksibilitet;Vores kør-selv ture giver dig den største fleksibilitet.
da1f7e3e3ee5488fbee0b7b4c8d1fb91;landing.selfdrive.staticContent.subtitle;Explorez une destination à votre propre rythme, arrêtez-vous où vous voulez et passez-y le temps que vous voulez.;Verken een bestemming in je eigen tempo – en je kunt stoppen waar en zolang je maar wilt.;Explore a destination at your own pace – stopping where you want and spending as long as you want there.;Explore um destino no seu próprio ritmo: pare onde quiser e pelo tempo que quiser.;Utforska ett resmål i din egen takt - stanna till var du vill och stanna så länge du vill.;Utforsk et reisemål i ditt eget tempo - stopp hvor du vil og tilbring så lang tid du vil der.;Udforsk et rejsemål i dit eget tempo - stop, hvor du vil, og brug så lang tid, som du vil.
